operator_1	本日はご利用いただきまして、ありがとうございます。│ご宿泊のご相談を承ります。▁│お宿につきまして、どのような条件をご希望でしょうか?
customer_15	大人1名、子供1名の親子で4泊の旅を予定しています。▁│ツインの部屋を希望します。
operator_1	さようでございますか。│どちらにご旅行なさいますか?
customer_15	山梨県を予定しています。▁│レンタカーを利用して自然を楽しみたいと思っています。
operator_1	かしこまりました。│お日付はいかがでしょうか?
customer_15	7月13日から4泊でお願いします。
operator_1	かしこまりました。│山梨県でどちらかご希望はございますでしょうか?▁│7月に自然をお楽しみになるようでしたら、八ヶ岳地域がおすすめです。
customer_15	希望しているのは桃狩りや尾白川の周辺です。│八ヶ岳地域からそれらは遠いですか?
operator_1	さほど遠くにはなりませんが、尾白川ですと北杜市がよろしいかと思います。│そちらでお調べしましょうか?
customer_15	では北杜市でお願いします。
operator_1	かしこまりました。│桃狩りをお楽しみになるご予定でしたら、近くに桃園のあるお宿をお探ししましょうか?
customer_15	ありがとうございます!│桃園が近いといいですね。
operator_1	ありがとうございます。│では、桃園の近くの宿をお探しいたします。▁│お食事ですが、バーベキューのできる宿はいかがでしょう?│夏ですし、お子様にお喜びいただけるかと思いまして。
customer_15	バーベキューができる宿なんてあるんですね。│思い出になりそうなのでお願いします。
operator_1	かしこまりました。│こちらのご旅行ですが、お車でしょうか?
customer_15	はい、その予定です。
operator_1	かしこまりました。│それでは、インターチェンジから近いお宿がよろしいでしょうか?
customer_15	そうですね。│お願いします。
operator_1	承知しました。│お部屋からの眺めのご希望はございますでしょうか?▁│北杜市ですと、甲斐駒ヶ岳や南アルプスをご覧いただけるところがございますので。
customer_15	ありがたいです。▁│名水で有名だと聞いているので南アルプスを臨める部屋がいいです。
operator_1	かしこまりました。│それでは、南アルプスのマウンテンビューのお部屋をお探しします。▁│ほかにご希望はございますでしょうか?│特にございませんでしたら、以上の条件でお宿をお調べいたします。
customer_15	他には特にないので、以上でよろしくおねがいします。
operator_1	かしこまりました。│それでは、以下のご希望条件に合うお宿をお探しいたします。
operator_1	・日付は7月13日。▁│・宿泊日数は4泊。▁│・宿泊地は山梨県北杜市。▁│・人数は大人1名、子供1名。▁│・部屋タイプ/数はツインルーム1室。▁│・近くに桃園のある宿を希望。▁│・バーベキューのできる宿を希望。▁│・インターチェンジから近い宿を希望。▁│・南アルプスのマウンテンビューの部屋を希望。
